{
  "id": "binary:jq",
  "kind": "binary",
  "name": "jq",
  "version": "1.7.1",

  "delivery": "remote",
  "install": {
    "source": "download",
    "platforms": {
      "darwin-arm64": {
        "url": "https://github.com/jqlang/jq/releases/download/jq-1.7.1/jq-macos-arm64",
        "checksum": { "algo": "sha256", "value": "0000000000000000000000000000000000000000000000000000000000000000" },
        "extract": { "type": "raw" }
      },
      "darwin-x64": {
        "url": "https://github.com/jqlang/jq/releases/download/jq-1.7.1/jq-macos-amd64",
        "checksum": { "algo": "sha256", "value": "0000000000000000000000000000000000000000000000000000000000000000" },
        "extract": { "type": "raw" }
      },
      "linux-x64": {
        "url": "https://github.com/jqlang/jq/releases/download/jq-1.7.1/jq-linux-amd64",
        "checksum": { "algo": "sha256", "value": "0000000000000000000000000000000000000000000000000000000000000000" },
        "extract": { "type": "raw" }
      }
    }
  },

  "bins": ["jq"],

  "detect": {
    "command": "jq --version",
    "expectExitCode": 0
  },

  "meta": {
    "description": "Command-line JSON processor",
    "category": "data"
  }
}
